Nama Makanan,Bahan,Instruksi
Nasi Goreng,"Nasi putih, Bawang merah, Bawang putih, Kecap manis, Telur, Ayam, Garam, Merica","Tumis bawang merah dan bawang putih hingga harum. Tambahkan ayam dan masak hingga matang. Masukkan nasi putih, kecap manis, garam, dan merica. Aduk hingga merata. Tambahkan telur dan aduk hingga matang."
Soto Ayam,"Ayam, Bawang putih, Bawang merah, Jahe, Kunyit, Sereh, Daun jeruk, Garam, Merica, Soun, Telur rebus, Daun seledri, Bawang goreng, Jeruk nipis","Rebus ayam hingga matang, angkat dan suwir-suwir dagingnya. Tumis bawang putih, bawang merah, jahe, kunyit, sereh, dan daun jeruk hingga harum. Masukkan tumisan ke dalam kaldu ayam. Tambahkan garam dan merica. Sajikan dengan soun, telur rebus, daun seledri, bawang goreng, dan perasan jeruk nipis."
Rendang,"Daging sapi, Santan, Bawang merah, Bawang putih, Cabai merah, Serai, Daun jeruk, Kunyit, Jahe, Lengkuas, Kelapa parut sangrai, Garam","Haluskan bawang merah, bawang putih, cabai merah, kunyit, jahe, dan lengkuas. Tumis bumbu halus bersama serai dan daun jeruk hingga harum. Masukkan daging sapi dan aduk hingga berubah warna. Tambahkan santan dan kelapa parut sangrai. Masak dengan api kecil hingga daging empuk dan bumbu meresap."
Roti,"tepung terigu,telur,susu",olah menggunakan alat
rendang,"santan,daging sapi",tumis daging
